{
  "protocol_version": 1,
  "profile_version": 1,
  "task_id": "task-1",
  "task_revision": 1,
  "command_id": "cmd-1",
  "device_id": "device-1",
  "session_id": "session-1",
  "operation": "select_candidate",
  "arguments": {
    "ref": "candidate-2"
  },
  "expected_observation_version": 3,
  "expires_at": "2026-10-27T12:00:30Z"
}
